<?xml version="1.0" encoding="UTF-8"?>
 <!ELEMENT galeries (galerie+)>
 <!ELEMENT galerie (gerant,contenu)>
 <!ATTLIST galerie adresse CDATA  #REQUIRED>
 <!ELEMENT gerant (#PCDATA)>
 <!ELEMENT contenu (type,auteur,titre?,prix?)>
 <!ELEMENT type (#PCDATA)>
 <!ELEMENT auteur (#PCDATA)>
 <!ELEMENT titre (#PCDATA)>
 <!ELEMENT prix (#PCDATA)>
